JyDeR4p9l,四川中江樱花岭,2550900981,#英国发现新冠变种病毒#14日，英国卫生大臣汉考克在议会通报新冠进展时透露，英国东南部发现了一种新冠变种病毒。这种病毒传播比新冠更快，已经在英国超过60个区域发现了至少1000个病例。汉考克称目前无证据称病毒突变会让疫苗失效。中江樱花岭#新型冠状病毒##生活#2成都​,2020-12-15 23:28,1,0,1,https://weibo.com/2550900981/JyDeR4p9l?refer_flag=1001030103_
JyDex13IL,用户7397682670,7397682670,我发表了头条文章:《新型冠状病毒制造与治疗方法》O新型冠状病毒制造与治疗方法​,2020-12-15 23:27,0,0,1,https://weibo.com/7397682670/JyDex13IL?refer_flag=1001030103_
JyD8Q8E4m,Pony谢,6311650064,截至12月14日24时新型冠状病毒肺炎疫情最新情况O截至12月14日24时新型冠状病毒肺炎疫情最新情况​,2020-12-15 23:13,0,0,0,https://weibo.com/6311650064/JyD8Q8E4m?refer_flag=1001030103_
JyDOD3k4x,套路小马甲,5977796892,新型冠状病毒被英国人杂交了英国60个地区发现新冠病毒新变种：传播速度更快，已感染上千人#英国发现新冠变种病毒##环球见闻#​​​​L套路小马甲的微博视频​,2020-12-16 00:56,0,0,0,https://weibo.com/5977796892/JyDOD3k4x?refer_flag=1001030103_
JyDMPzJPv,笑味君,6418001968,新型冠状病毒被英国人杂交了英国60个地区发现新冠病毒新变种：传播速度更快，已感染上千人  #英国发现新冠变种病毒##环球见闻#L笑味君的微博视频​,2020-12-16 00:52,0,0,0,https://weibo.com/6418001968/JyDMPzJPv?refer_flag=1001030103_
JyDKa8vht,Wakakakaa灬小跟班-001,3481599831,这段视频很有意思>>《新型冠状病毒灭活口罩来了，你会选择么？》O网页链接​,2020-12-16 00:45,0,0,0,https://weibo.com/3481599831/JyDKa8vht?refer_flag=1001030103_
JyDIHsIni,用户7536399735,7536399735,实时更新|新型冠状病毒肺炎全国疫情地图O实时更新|新冠肺炎疫情地图​,2020-12-16 00:42,0,0,1,https://weibo.com/7536399735/JyDIHsIni?refer_flag=1001030103_
JyE2fzaBE,美国侨报网,1823184085,【#聚焦纽约#】纽约市长白思豪：圣诞节后或再次关闭城市纽约市市长白思豪表示，几周后全市可能再次关闭。虽然政府关门的最终决定权在纽约州州长葛谟手中，但白思豪在12月15日的新闻发布会上表示，提议将在圣诞节后公布。#新型冠状病毒##美国疫情#O网页链接L美国侨报网的微博视频​,2020-12-16 01:30,0,0,2,https://weibo.com/1823184085/JyE2fzaBE?refer_flag=1001030103_
JyE2bpUDh,岚客岚,1977132287,#如果圣诞老人得新冠#然后重症监护室怎么办？#法国##海外抗疫日记##新型冠状病毒#2法国·南特​,2020-12-16 01:30,0,0,0,https://weibo.com/1977132287/JyE2bpUDh?refer_flag=1001030103_
JyDYyiimM,视频会长,6077930847,新型冠状病毒被英国人杂交了英国60个地区发现新冠病毒新变种：传播速度更快，已感染上千人#英国发现新冠变种病毒##环球见闻#​​​​​​​​​​​​​​​​​​​​​​​​​​​​L视频会长的微博视频​,2020-12-16 01:21,0,0,1,https://weibo.com/6077930847/JyDYyiimM?refer_flag=1001030103_
JyDWRm4dO,视频黑洞,5678225842,新型冠状病毒被英国人杂交了英国60个地区发现新冠病毒新变种：传播速度更快，已感染上千人#英国发现新冠变种病毒##环球见闻#​​​​​​​​​​​​​​​​​​​​L视频黑洞的微博视频​,2020-12-16 01:16,0,0,0,https://weibo.com/5678225842/JyDWRm4dO?refer_flag=1001030103_
JyDUSa3K4,热门视频合集,2820236807,新型冠状病毒被英国人杂交了英国60个地区发现新冠病毒新变种：传播速度更快，已感染上千人#英国发现新冠变种病毒##环球见闻#​​​​​​​​​​​​​​​​L热门视频合集的微博视频​,2020-12-16 01:12,0,0,0,https://weibo.com/2820236807/JyDUSa3K4?refer_flag=1001030103_
JyDSIjCso,奇葩帖,5974451612,新型冠状病毒被英国人杂交了英国60个地区发现新冠病毒新变种：传播速度更快，已感染上千人#英国发现新冠变种病毒##环球见闻#​​​​​​​​​​​​​​​​L奇葩帖的微博视频​,2020-12-16 01:06,0,0,0,https://weibo.com/5974451612/JyDSIjCso?refer_flag=1001030103_
JyDSH4nUL,你的脑洞比我大,3630503394,新型冠状病毒被英国人杂交了英国60个地区发现新冠病毒新变种：传播速度更快，已感染上千人#英国发现新冠变种病毒##环球见闻#​​​​​​​​​​​​​​​​L你的脑洞比我大的微博视频​,2020-12-16 01:06,0,0,0,https://weibo.com/3630503394/JyDSH4nUL?refer_flag=1001030103_
JyDQUxjP4,幽默大奇葩,6323059623,新型冠状病毒被英国人杂交了英国60个地区发现新冠病毒新变种：传播速度更快，已感染上千人#英国发现新冠变种病毒##环球见闻#​​​​​​​​​​​​L幽默大奇葩的微博视频​,2020-12-16 01:02,0,0,0,https://weibo.com/6323059623/JyDQUxjP4?refer_flag=1001030103_
JyDQFufq4,幽默大逗比,6389694612,新型冠状病毒被英国人杂交了英国60个地区发现新冠病毒新变种：传播速度更快，已感染上千人#英国发现新冠变种病毒##环球见闻#​​​​​​​​​​​​L幽默大逗比的微博视频​,2020-12-16 01:01,0,0,0,https://weibo.com/6389694612/JyDQFufq4?refer_flag=1001030103_
JyDQt6Twe,热门搞笑贴,6078522958,新型冠状病毒被英国人杂交了英国60个地区发现新冠病毒新变种：传播速度更快，已感染上千人#英国发现新冠变种病毒##环球见闻#​​​​​​​​L热门搞笑贴的微博视频​,2020-12-16 01:01,1,0,0,https://weibo.com/6078522958/JyDQt6Twe?refer_flag=1001030103_
JyFFqdd4i,CrystalPearl,1456735502,"维州今日疫情：过去24小时️新增新型冠状病毒确诊病例。检测量9711次，累计确诊20,352例。#澳大利亚疫情##全球疫情##海外抗疫日记#澳大利亚2澳大利亚​",2020-12-16 05:39,1,0,7,https://weibo.com/1456735502/JyFFqdd4i?refer_flag=1001030103_
JyFWhamX0,愛穿十一號,2753432451,皇家马德里后卫米利唐确诊感染新型冠状病毒肺炎。​,2020-12-16 06:21,0,0,0,https://weibo.com/2753432451/JyFWhamX0?refer_flag=1001030103_
JyFUqcsyE,用户7136705680,7136705680,实时更新|新型冠状病毒肺炎全国疫情地图O实时更新|新冠肺炎疫情地图​,2020-12-16 06:16,0,0,0,https://weibo.com/7136705680/JyFUqcsyE?refer_flag=1001030103_
JyGsrnvBq,册亨气象局57909,5290788272,"【册亨县气象台】12月16日07时发布早间预报:今天白天全县各地阴天有零星小雨,今天夜间阴天有小雨,县城气温5～8℃.温馨提示:地势较高地区有雾,外出注意行车安全;气温低,注意添衣保暖,用炭火取暖时谨防一氧化碳中毒;常洗手,常消毒,勤通风,勤换气,预防新型冠状病毒肺炎从我做起！​",2020-12-16 07:40,0,0,0,https://weibo.com/5290788272/JyGsrnvBq?refer_flag=1001030103_
JyGoiCEgd,延边发布,3486040040,【延边州关于新型冠状病毒肺炎疫情的通报】2020年12月15日0-24时，延边州无新增新冠肺炎确诊病例报告。​,2020-12-16 07:30,0,0,0,https://weibo.com/3486040040/JyGoiCEgd?refer_flag=1001030103_
JyGltDrcu,长春黑Man,5039890713,吉林省卫生健康委关于新型冠状病毒肺炎疫情情况通报（2020年12月15日公布）O吉林省卫生健康委关于新型冠状病毒肺炎疫情情况通报（2020年12月15日公布）​,2020-12-16 07:23,0,0,0,https://weibo.com/5039890713/JyGltDrcu?refer_flag=1001030103_
JyGeut8NW,落寞桥头,5946036262,截至12月14日24时新型冠状病毒肺炎疫情最新情况O截至12月14日24时新型冠状病毒肺炎疫情最新情况​,2020-12-16 07:05,0,0,1,https://weibo.com/5946036262/JyGeut8NW?refer_flag=1001030103_
JyGe8mO2e,CrystalPearl,1456735502,昆士兰州最新数据：过去24小时新增例1⃣️新型冠状病毒确诊病例，累计确诊1229例。为海外返澳人士。#全球疫情##澳大利亚疫情##海外抗疫日记#澳大利亚​​​2澳大利亚​,2020-12-16 07:05,1,0,5,https://weibo.com/1456735502/JyGe8mO2e?refer_flag=1001030103_
JyGYNavz2,浙江发布,5131766197,【2020年12月16日浙江省新型冠状病毒肺炎疫情情况】12月15日0-24时，无新增确诊病例。截至15日24时，累计报告确诊病例1297例（境外输入病例78例）。via健康浙江​,2020-12-16 08:59,9,0,1,https://weibo.com/5131766197/JyGYNavz2?refer_flag=1001030103_
JyGYr5gf0,不喔2017,6218330998,无牌无调瞎哼哼2940.冬月初二（新型冠状病毒）云语遥赞塞北雪，惹来川西雨。敲窗泣问我，蜀人何不喜。怕她心眼小，没敢胡乱比。只说被窝暖，假寐思道理。​,2020-12-16 08:59,0,0,0,https://weibo.com/6218330998/JyGYr5gf0?refer_flag=1001030103_
JyGWKqDna,手机用户2621652091,2621652091,截至12月8日24时新型冠状病毒肺炎疫情最新情况O截至12月8日24时新型冠状病毒肺炎疫情最新情况​,2020-12-16 08:54,0,0,0,https://weibo.com/2621652091/JyGWKqDna?refer_flag=1001030103_
JyGTLcwKq,天津健康,3244253572,【权威发布】2020年12月16日天津市新型冠状病毒肺炎疫情情况​,2020-12-16 08:47,0,0,1,https://weibo.com/3244253572/JyGTLcwKq?refer_flag=1001030103_
JyGT7eCnv,美国侨报网,1823184085,【#突发美国#】辉瑞CEO称尚未接种该款疫苗：正建立机构评估辉瑞公司首席执行官布尔拉表示自己尚未接种该公司研发的新冠疫苗。#美国疫情##辉瑞疫苗##新型冠状病毒#O网页链接L美国侨报网的微博视频​,2020-12-16 08:45,1,0,4,https://weibo.com/1823184085/JyGT7eCnv?refer_flag=1001030103_
JyGSXbPQY,健康宣城,6085600653,【科普】口罩为什么可以预防新型冠状病毒感染？O网页链接​,2020-12-16 08:45,0,0,0,https://weibo.com/6085600653/JyGSXbPQY?refer_flag=1001030103_
JyGSA8Xxg,德州经济技术开发区,5040305750,2020年12月15日0时至24时山东省新型冠状病毒肺炎疫情情况O2020年12月15日0时至24时山东省新型冠状病毒肺炎疫情情况​,2020-12-16 08:44,0,0,0,https://weibo.com/5040305750/JyGSA8Xxg?refer_flag=1001030103_
JyGRei87H,韩联社中文网微博,3738708562,【简讯：韩国新增**例新冠确诊病例累计45442例】韩国中央防疫对策本部16日通报，截至当天0时，韩国较前一天0时新增感染新型冠状病毒（COVID-19）确诊病例...O网页链接​,2020-12-16 08:41,0,0,0,https://weibo.com/3738708562/JyGRei87H?refer_flag=1001030103_
JyHm3wzZa,贺兰微博,2129935833,健康科普｜口罩为什么可以预防新型冠状病毒感染？O健康科普｜口罩为什么可以预防新型冠状病毒感染？​,2020-12-16 09:57,0,0,0,https://weibo.com/2129935833/JyHm3wzZa?refer_flag=1001030103_
JyHkRh5qv,西南石油大学青年志愿者协会,1618878025,【四川省新型冠状病毒肺炎疫情最新情况（12月16日发布）】12月15日0-24时，四川无新增新冠肺炎确诊病例，无新增治愈出院病例，无新增疑似病例，无新增死亡病例。截至12月16日0时，全省累计确诊838例(境外输入285例），累计治愈出院794例，死亡3例，目前在院隔离治疗41例。2成都·西南石油大学成都校区​,2020-12-16 09:54,0,0,0,https://weibo.com/1618878025/JyHkRh5qv?refer_flag=1001030103_
JyHkksZET,网信三河,6160889750,#疫情防控#截至12月15日24时新型冠状病毒肺炎疫情最新情况O截至12月15日24时新型冠状病毒肺炎疫情最新情况​,2020-12-16 09:53,0,0,0,https://weibo.com/6160889750/JyHkksZET?refer_flag=1001030103_
JyHKUa2Rv,事实调查,3522014302,截至12月15日24时新型冠状病毒肺炎疫情最新情况O网页链接​,2020-12-16 10:58,0,0,0,https://weibo.com/3522014302/JyHKUa2Rv?refer_flag=1001030103_
JyHJSoNqx,双流应急,2881030352,#都知道#12月15日0至24时新型冠状病毒肺炎疫情最新情况。@健康成都官微​​​（成都发布）​,2020-12-16 10:55,0,0,0,https://weibo.com/2881030352/JyHJSoNqx?refer_flag=1001030103_
JyHGGkvto,文旅青白江,2410556825,#都知道#12月15日0至24时新型冠状病毒肺炎疫情最新情况。@健康成都官微​​​,2020-12-16 10:48,0,0,0,https://weibo.com/2410556825/JyHGGkvto?refer_flag=1001030103_
JyHGia5D1,闽南生活网,6127950989,#新闻看点#据成都市卫健委消息，14日0时至24时，四川省新增新型冠状病毒肺炎确诊病例6例（1例为本地病例，5例为境外输入）。某境外输入病例详情境外输入者高某，男，26岁，中国籍。...O一飞行员确诊，曾参加300人婚宴，涉事酒店已经封闭​,2020-12-16 10:47,0,0,0,https://weibo.com/6127950989/JyHGia5D1?refer_flag=1001030103_
JyHG2dL4b,不喔2017,6218330998,无牌无调瞎哼哼2940.冬月初二（新型冠状病毒）云语遥赞塞北雪，惹来川西雨。敲窗泣问我，蜀人何不喜。怕她心眼小，没敢胡乱比。只说被窝暖，假寐思道理。​​​,2020-12-16 10:46,0,0,0,https://weibo.com/6218330998/JyHG2dL4b?refer_flag=1001030103_
JyHDGtFXh,成都工会,3547956493,#都知道#12月15日0至24时新型冠状病毒肺炎疫情最新情况。@健康成都官微​​​​,2020-12-16 10:40,0,0,0,https://weibo.com/3547956493/JyHDGtFXh?refer_flag=1001030103_
JyHDsn8Ny,番茄小琼03,7215987364,截至12月15日24时新型冠状病毒肺炎疫情最新情况O截至12月15日24时新型冠状病毒肺炎疫情最新情况​,2020-12-16 10:40,0,0,0,https://weibo.com/7215987364/JyHDsn8Ny?refer_flag=1001030103_
JyI99or9E,追梦青春_76812,5587829506,截至12月15日24时新型冠状病毒肺炎疫情最新情况O截至12月15日24时新型冠状病毒肺炎疫情最新情况​,2020-12-16 11:58,0,0,0,https://weibo.com/5587829506/JyI99or9E?refer_flag=1001030103_
JyI6L4nBv,用户7372809643,7372809643,截至12月15日24时新型冠状病毒肺炎疫情最新情况O截至12月15日24时新型冠状病毒肺炎疫情最新情况​,2020-12-16 11:52,0,0,0,https://weibo.com/7372809643/JyI6L4nBv?refer_flag=1001030103_
JyI2jD5iu,环球新视界天行道义,6352876244,《实时更新：新型冠状病毒肺炎疫情地图》全国新型冠状病毒肺炎实时地图O网页链接​,2020-12-16 11:41,0,0,2,https://weibo.com/6352876244/JyI2jD5iu?refer_flag=1001030103_
JyI0PsGtm,郝桂霞77223,7232638100,截至12月15日24时新型冠状病毒肺炎疫情最新情况O截至12月15日24时新型冠状病毒肺炎疫情最新情况​,2020-12-16 11:37,0,0,0,https://weibo.com/7232638100/JyI0PsGtm?refer_flag=1001030103_
JyHZLwK6Q,江西省人民政府公报,3444361032,2020年12月15日江西省新型冠状病毒肺炎疫情情况O2020年12月15日江西省新型冠状病毒肺炎疫情情况​,2020-12-16 11:35,0,0,0,https://weibo.com/3444361032/JyHZLwK6Q?refer_flag=1001030103_
JyIwRnl8f,用户6392045626,6392045626,截至12月15日24时新型冠状病毒肺炎疫情最新情况O截至12月15日24时新型冠状病毒肺炎疫情最新情况​,2020-12-16 12:56,0,0,0,https://weibo.com/6392045626/JyIwRnl8f?refer_flag=1001030103_
JyIv8tAmk,琴琴阳光,3879331768,福建省卫生健康委员会官网(2O2O年12月16日发布)福建省新型冠状病毒肺炎疫情情况L琴琴阳光的微博视频​,2020-12-16 12:52,0,0,0,https://weibo.com/3879331768/JyIv8tAmk?refer_flag=1001030103_
JyIuW6fRX,城市观察CITY,6914600655,【成都市12月15日0至24时新型冠状病毒肺炎疫情最新情况】​​​@健康成都官微​,2020-12-16 12:51,0,0,2,https://weibo.com/6914600655/JyIuW6fRX?refer_flag=1001030103_
JyIuL6U6g,芊泽和芊译,6238805354,截至12月15日24时新型冠状病毒肺炎疫情最新情况O截至12月15日24时新型冠状病毒肺炎疫情最新情况​,2020-12-16 12:51,0,0,0,https://weibo.com/6238805354/JyIuL6U6g?refer_flag=1001030103_
JyIrEq0nf,伊春发布,2619904613,【中国疾控中心提示：公众预防应该怎么做？】#新型冠状病毒#公众预防指南——通用预防篇#预防新型冠状病毒肺炎#L黑龙江日报的微博视频​​​,2020-12-16 12:43,0,0,1,https://weibo.com/2619904613/JyIrEq0nf?refer_flag=1001030103_
JyIkFABf1,空港融媒,3469830734,【疫情防控，你的手洗对了吗？】新型冠状病毒不仅可通过呼吸道传播也可以通过眼睛传播，就算你戴着口罩，如果不注意手部卫生都可能发生感染，所以，你的手洗对了吗？戳：O视频丨疫情防控，你的手洗对了吗?​​​,2020-12-16 12:26,0,0,1,https://weibo.com/3469830734/JyIkFABf1?refer_flag=1001030103_
JyIfmoTTL,成都工会,3547956493,#疫情防控动态##都知道#12月15日0至24时新型冠状病毒肺炎疫情最新情况。@健康成都官微​​​​,2020-12-16 12:13,1,10,11,https://weibo.com/3547956493/JyIfmoTTL?refer_flag=1001030103_
JyIesz309,北京市肛肠医院__,6192841600,【北京疾控提醒您】预防新型冠状病毒，居家清洁消毒应该注意这六点！@健康中国@首都健康@北京中医局@北京疾病预防与控制中心@北京西城@西城健康O【北京疾控提醒您】预防新型冠状病毒，居家清洁消毒应该注意这六点！​,2020-12-16 12:11,0,0,0,https://weibo.com/6192841600/JyIesz309?refer_flag=1001030103_
JyIerEHXm,CrystalPearl,1456735502,澳大利亚ACT领地官宣:过去24小时️新增新型冠状病毒确诊病例，累计确诊人数117例。#澳大利亚疫情##全球疫情##海外抗疫日记#澳大利亚​​2澳大利亚​,2020-12-16 12:11,0,0,7,https://weibo.com/1456735502/JyIerEHXm?refer_flag=1001030103_
JyIb3uHJS,碎纸片儿201610,5835865333,截至12月15日24时新型冠状病毒肺炎疫情最新情况O截至12月15日24时新型冠状病毒肺炎疫情最新情况​,2020-12-16 12:02,0,0,0,https://weibo.com/5835865333/JyIb3uHJS?refer_flag=1001030103_
JyIa47yaz,聪明的老实人199409,7186294023,截至12月15日24时新型冠状病毒肺炎疫情最新情况O截至12月15日24时新型冠状病毒肺炎疫情最新情况​,2020-12-16 12:00,0,0,0,https://weibo.com/7186294023/JyIa47yaz?refer_flag=1001030103_
JyINQfQa9,蛟河发布,1140892385,【吉林省卫生健康委关于新型冠状病毒肺炎疫情情况通报（2020年12月15日公布）】O吉林省卫生健康委关于新型冠状病毒肺炎疫情情况通报（2020年12月15日公布）​,2020-12-16 13:38,0,0,0,https://weibo.com/1140892385/JyINQfQa9?refer_flag=1001030103_
JyILjkl4s,琴琴阳光,3879331768,山东省卫生健康委员会官网(2O2O年12月16日发布)2O2O年12月15日O时至24时山东省新型冠状病毒肺炎疫情情况L琴琴阳光的微博视频​,2020-12-16 13:32,0,0,0,https://weibo.com/3879331768/JyILjkl4s?refer_flag=1001030103_
JyIGz0Po0,星陈吗,6295917178,截至12月15日24时新型冠状病毒肺炎疫情最新情况O截至12月15日24时新型冠状病毒肺炎疫情最新情况​,2020-12-16 13:20,0,0,0,https://weibo.com/6295917178/JyIGz0Po0?refer_flag=1001030103_
JyIG6ph9S,用户7451575492,7451575492,截至12月15日24时新型冠状病毒肺炎疫情最新情况O截至12月15日24时新型冠状病毒肺炎疫情最新情况​,2020-12-16 13:19,0,0,0,https://weibo.com/7451575492/JyIG6ph9S?refer_flag=1001030103_
JyJh6iufG,云财经,1680685707,【江苏新冠疫苗采购价格公布中标价格200元/支】云财经讯，12月15日，江苏省药品(医用耗材)阳光采购和综合监管平台发布《省公共资源交易中心关于公布新型冠状病毒疫苗采购结果的通知》，北京科兴中维生物技术有限公司和北京生物制品研究所有限公司中标，中标价格均为200元/支。​,2020-12-16 14:50,5,24,40,https://weibo.com/1680685707/JyJh6iufG?refer_flag=1001030103_
JyJgLjHfs,册亨气象局57909,5290788272,"【册亨县气象台】12月16日14时发布天气预报:16日夜间全县各地阴天有小雨,地势高处有雾,17日白天阴天有零星小雨,县城气温4～8℃.温馨提示:地势高处有雾,外出注意行车安全;气温低,注意添衣保暖,用炭火取暖时谨防一氧化碳中毒;常洗手,常消毒,勤通风,勤换气,预防新型冠状病毒肺炎从我做起！​",2020-12-16 14:49,0,0,0,https://weibo.com/5290788272/JyJgLjHfs?refer_flag=1001030103_
JyJdfwVyX,Jalal佳蓝,3196947361,在过去的24个小时阿富汗新冠病毒报告：新增病例：256恢复：90死亡：26例#阿富汗##新冠病毒##新型冠状病毒##covid-19#2阿富汗​,2020-12-16 14:41,0,0,1,https://weibo.com/3196947361/JyJdfwVyX?refer_flag=1001030103_
JyJd89QhZ,健康德阳官微,3209704633,#每日疫情通报#【德阳市新型冠状病毒肺炎疫情最新通报】12月15日，德阳市无新增新冠肺炎确诊病例，无新增无症状感染者。截至12月15日24时，德阳市累计报告确诊病例18例（绵竹市8例、广汉市5例、旌阳区4例、中江县1例），出院18人。累积报告境外输入无症状感染者2人（罗江区1人、中江县1人）。​,2020-12-16 14:40,2,0,0,https://weibo.com/3209704633/JyJd89QhZ?refer_flag=1001030103_
JyJcI8zzZ,琴琴阳光,3879331768,天津市卫生健康委员会官网(2O2O年12月16日发布)2O2O年12月16日天津市新型冠状病毒肺炎疫情情况L琴琴阳光的微博视频​,2020-12-16 14:39,0,0,0,https://weibo.com/3879331768/JyJcI8zzZ?refer_flag=1001030103_
JyJcr1prX,航运界网,1699637087,【嘉年华魅力号转型成为新一代浮动酒店】此前邮轮巨头嘉年华邮轮公司在新型冠状病毒期间，出售两艘邮轮以保持资金流动。这两艘邮轮分别是“CarnivalFascination”号（嘉年华魅力号）和“CarnivalImagination”号（嘉年华想象号），这两艘船一直处于长期搁置状态。O网页链接​,2020-12-16 14:39,0,0,0,https://weibo.com/1699637087/JyJcr1prX?refer_flag=1001030103_
JyJ9Ods6g,财经时报日本,7407896365,#财经时报日本速报#【#东京今日确认新冠感染678人#】东京都今天确认了678人感染新型冠状病毒，这是有史以来最多的一次。重症患者的人数在紧急情况宣布解除后，比昨天最多的78人减少了9人，重症者69人。#东京##日本疫情##关注新冠肺炎#​,2020-12-16 14:32,0,0,1,https://weibo.com/7407896365/JyJ9Ods6g?refer_flag=1001030103_
JyJ8Y8FSA,股林隐士V,5618091575,【#江苏新冠疫苗采购价格公布#中标价格200元/支】12月15日，江苏省药品（医用耗材）阳光采购和综合监管平台发布《省公共资源交易中心关于公布新型冠状病毒疫苗采购结果的通知》，北京科兴中维生物技术有限公司和北京生物制品研究所有限公司中标，中标价格均为200元/支。​​​,2020-12-16 14:30,0,0,13,https://weibo.com/5618091575/JyJ8Y8FSA?refer_flag=1001030103_
JyJ8r7opG,铜锣烧66666,5400813452,截至12月15日24时新型冠状病毒肺炎疫情最新情况O截至12月15日24时新型冠状病毒肺炎疫情最新情况​,2020-12-16 14:29,0,0,0,https://weibo.com/5400813452/JyJ8r7opG?refer_flag=1001030103_
JyJ6TmUQk,董事会杂志,1668695325,【江苏新冠疫苗采购价格公布中标价格200元/支】12月15日，江苏省药品（医用耗材）阳光采购和综合监管平台发布《省公共资源交易中心关于公布新型冠状病毒疫苗采购结果的通知》，北京科兴中维生物技术有限公司和北京生物制品研究所有限公司中标，中标价格均为200元/支。​,2020-12-16 14:25,0,0,0,https://weibo.com/1668695325/JyJ6TmUQk?refer_flag=1001030103_
JyJ6lExka,图解日本,2051389607,【速报|东京都新型冠状病毒新感染者678人创历史新高】12月16日东京都确认的新型冠状病毒新感染者为678人，创下了单日感染者最多记录。此前最多的是12月12日的621人。#社会科学##海外抗疫日记##日本疫情#L图解日本的微博视频​,2020-12-16 14:24,1,0,2,https://weibo.com/2051389607/JyJ6lExka?refer_flag=1001030103_
JyJ5GhsRA,经济观察报,1641561812,【#江苏新冠疫苗采购价格公布#中标价格200元/支】#经观快讯#日前，江苏省药品（医用耗材）阳光采购和综合监管平台发布《省公共资源交易中心关于公布新型冠状病毒疫苗采购结果的通知》，北京科兴中维生物技术有限公司和北京生物制品研究所有限公司中标，中标价格均为200元/支。O江苏新冠疫苗采购价格公布中标价格200元/支​,2020-12-16 14:22,4,0,11,https://weibo.com/1641561812/JyJ5GhsRA?refer_flag=1001030103_
JyJH0B8SD,刀客集中营,1356057291,【江苏新冠疫苗采购价格公布中标价格200元/支】12月15日，江苏省药品（医用耗材）阳光采购和综合监管平台发布《省公共资源交易中心关于公布新型冠状病毒疫苗采购结果的通知》，北京科兴中维生物技术有限公司和北京生物制品研究所有限公司中标，中标价格均为200元/支。​,2020-12-16 15:54,1,0,2,https://weibo.com/1356057291/JyJH0B8SD?refer_flag=1001030103_
JyJG2ly1S,波浪正宗-股市007,1699547483,【#江苏新冠疫苗采购价格公布#中标价格200元/支】12月15日，江苏省药品（医用耗材）阳光采购和综合监管平台发布《省公共资源交易中心关于公布新型冠状病毒疫苗采购结果的通知》，北京科兴中维生物技术有限公司和北京生物制品研究所有限公司中标，中标价格均为200元/支。​​​​股市​,2020-12-16 15:51,2,0,12,https://weibo.com/1699547483/JyJG2ly1S?refer_flag=1001030103_
JyJFh0wTR,慧眼看日本,3237442900,#日本疫情#【速报】根据16日15点的速报值，东京都内新增新型冠状病毒感染者678人，这迄今为止单天感染人数最多。此外，16日的重症患者比15日减少了9人，为69人。​,2020-12-16 15:50,1,0,1,https://weibo.com/3237442900/JyJFh0wTR?refer_flag=1001030103_
